<?xml version = "1.0" encoding = "UTF-8"?>

<?xml-stylesheet type="text/xsl" href="html-transformation-2.xsl"?>

<!DOCTYPE guitars_catalog SYSTEM "GuitarsCatalog.dtd">

<guitars_catalog>
<guitars>

    <descriptions>
        <guitar>
            <brand> Fender Squier Affinity Series Stratocaster </brand>
            <image> fender-olympic-white.jpg </image>
        </guitar>
        <description>
            Fender Squier Affinity Stratocaster е невероятно популярен поради доброто си качество на изработката.
            Когато става въпрос за електрически китари, качеството на пикапите (pickups) играе най-голяма роля в качеството на тона на китарата.
            Ако сте начинаещ, който започва да се занимава сериозно с китара, тогава Fender Squier Affinity би бил добър избор за Вас.
        </description>
    </descriptions>

    <descriptions>
        <guitar>
            <brand> Ibanez Cosmic Shadow </brand>
            <image> ibanez-black.jpg </image>
        </guitar>
        <description>
            Изработена с олекотен корпус от махагон и шия от 5 части клен/венге, тази китара се отличава с резонансен тон, който няма да ви тежи.
        </description>
    </descriptions>

    <descriptions>
        <guitar>
            <brand> Takamine GD51 Brown Sunburst </brand>
            <image> takamine.jpg </image>
        </guitar>
        <description>
            Готов за всяка ситуация на изпълнение, този модел се отличава с масивна горна част от смърч и черен орех отзад и отстрани, които произвеждат хубав и мощен звук.
        </description>
    </descriptions>

    <descriptions>
        <guitar>
            <brand> Framus FD Vintage </brand>
            <image> framus.jpg </image>
        </guitar>
        <description>
            Тази китара е перфектният избор както за начинаещи, така и за напреднали музиканти.
            Моделът е рядък, но изработен с висококачествени материали, което допринася и за нейния изчистен звук.
        </description>
    </descriptions>

    <descriptions>
        <guitar>
            <brand> Sire Marcus Miller V5 Alder-5 Натурал </brand>
            <image> bass-sire.jpg </image>
        </guitar>
        <description>
            Това е автентична джаз бас китара.
            За тези, които харесват лек бас и не обичат сложните настройки, това е много прост модел с прости настройки на звука.
            Идеална за начинаещи.
        </description>
    </descriptions>

    <descriptions>
        <guitar>
            <brand> Arrow MH-10 Концертно укулеле Натурал </brand>
            <image> ukulele.jpg </image>
        </guitar>
        <description>
            Моделът ARROW MH10 Concert Mahogany е укулеле с изящна изработка. Съставен е от най-добрите компоненти и се характеризира с мелодичен звук и интересен дизайн.
            Идеален за ежедневно свирене при всякакви условия, където и да се намирате.
        </description>
    </descriptions>

</guitars>
</guitars_catalog>