<?xml version = "1.0" encoding = "UTF-8"?>

<?xml-stylesheet type="text/xsl" href="html-transformation-4.xsl"?>

<!DOCTYPE guitars_catalog SYSTEM "GuitarsCatalog.dtd">

<!--> The most popular guitars from the collection (rating > 4.5) -->

<guitars_catalog>
    <guitars>
        <guitar>
            <brand> Fender Squier Affinity Series Stratocaster </brand>
            <image> fender-olympic-white.jpg </image>
            <company_name> Fender </company_name>
            <rating> 4.8 </rating>
        </guitar>
        <guitar>
            <brand> Ibanez Cosmic Shadow </brand>
            <image> ibanez-black.jpg </image>
            <company_name> Ibanez </company_name>
            <rating> 4.6 </rating>
        </guitar>
        <guitar>
            <brand> Takamine GD51 Brown Sunburst </brand>
            <image> takamine.jpg </image>
            <company_name> Takamine </company_name>
            <rating> 4.1 </rating>
        </guitar>
        <guitar>
            <brand> Framus FD Vintage </brand>
            <image> framus.jpg </image>
            <company_name> Framus Vintage </company_name>
            <rating> 4.7 </rating>
        </guitar>
        <guitar>
            <brand> Sire Marcus Miller V5 Alder-5 Натурал </brand>
            <image> bass-sire.jpg </image>
            <company_name> Sire </company_name>
            <rating> 4.3 </rating>
        </guitar>
        <guitar>
            <brand> Arrow MH-10 Концертно укулеле Натурал </brand>
            <image> ukulele.jpg </image>
            <company_name> Arrow </company_name>
            <rating> 4.5 </rating>
        </guitar>
    </guitars>
</guitars_catalog>