<?xml version = "1.0" encoding = "UTF-8"?>

<?xml-stylesheet type="text/xsl" href="txt-transformation-2.xsl"?>

<!DOCTYPE guitars_catalog SYSTEM "GuitarsCatalog.dtd">

<guitars_catalog>
    <guitars>
        <productDetails isAvailable="Не">
            <guitar>
                <brand> Fender Squier Affinity Series Stratocaster </brand>
                <image> fender-olympic-white.jpg </image>
            </guitar>
            <series guitarId="037-8002-505" />
            <fingerboard_material> Клен </fingerboard_material>
            <amount> 0 </amount>
            <condition> Отлично </condition>
            <comingWith> калъф, колан за китара, перце </comingWith>
        </productDetails>

        <productDetails isAvailable="Да">
            <guitar>
                <brand> Ibanez Cosmic Shadow </brand>
                <image> ibanez-black.jpg </image>
            </guitar>
            <series guitarId="RG5320L-CSW" />
            <fingerboard_material> Черен абанос </fingerboard_material>
            <amount> 1 </amount>
            <condition> Отлично </condition>
        </productDetails>

        <productDetails isAvailable="Да">
            <guitar>
                <brand> Takamine GD51 Brown Sunburst </brand>
                <image> takamine.jpg </image>
            </guitar>
            <series guitarId="GD51-BSB" />
            <fingerboard_material> Лавър </fingerboard_material>
            <amount> 3 </amount>
            <condition> Много добро </condition>
            <comingWith> калъф, колан за китара, тунер, перце </comingWith>
        </productDetails>

        <productDetails isAvailable="Да">
            <guitar>
                <brand> Framus FD Vintage </brand>
                <image> framus.jpg </image>
            </guitar>
            <series guitarId="FR-FD-14-SV-VSNT-CL2" />
            <fingerboard_material> Махагон </fingerboard_material>
            <amount> 5 </amount>
            <condition> Много добро </condition>
            <comingWith> калъф, колан за китара </comingWith>
        </productDetails>

        <productDetails isAvailable="Да">
            <guitar>
                <brand> Sire Marcus Miller V5 Alder-5 Натурал </brand>
                <image> bass-sire.jpg </image>
            </guitar>
            <series guitarId="V5-ALDER-5-NT" />
            <fingerboard_material> Елша </fingerboard_material>
            <amount> 2 </amount>
            <condition> Отлично </condition>
            <comingWith> калъф, колан за китара, тунер </comingWith>
        </productDetails>

        <productDetails isAvailable="Да">
            <guitar>
                <brand> Arrow MH-10 Концертно укулеле Натурал </brand>
                <image> ukulele.jpg </image>
            </guitar>
            <series guitarId="ARROW-MH10" />
            <fingerboard_material> Махагон </fingerboard_material>
            <amount> 3 </amount>
            <condition> Отлично </condition>
        </productDetails>
    </guitars>
</guitars_catalog>